{
  "schemaVersion": "0.2.0",
  "kind": "qop-canonical-record",
  "problem": {
    "kind": "Problem",
    "id": "krueger-2005-reduction-criterion-majorization",
    "accession": null,
    "aliases": [],
    "catalogState": "archived",
    "title": "Reduction criterion implies majorization?",
    "proposed": "2002-02-12",
    "topicId": "entanglement-theory",
    "collectionId": "krueger-2005",
    "question": {
      "type": "Implication between criteria",
      "summary": "The source asked whether the reduction criterion implies the majorization inequalities between the global and local spectra of a bipartite state. Hiroshima proved the implication in 2003.",
      "importance": "The answer places majorization at the weak end of the established chain separable implies PPT implies undistillable implies reduction, settling where the spectral criteria of Nielsen and Kempe sit inside the hierarchy of separability and distillability criteria.",
      "unresolved": ""
    },
    "keywords": [
      "reduction criterion",
      "majorization",
      "separability criteria",
      "distillability",
      "substochastic matrices"
    ],
    "relatedProblemIds": []
  },
  "statements": [
    {
      "kind": "StatementVersion",
      "id": "krueger-2005-reduction-criterion-majorization-statement-v1",
      "problemId": "krueger-2005-reduction-criterion-majorization",
      "version": 1,
      "supersedesStatementId": null,
      "created": "2026-08-12",
      "bodyPath": "statements/v1.md",
      "sourceRefs": [
        {
          "sourceId": "source-krueger-werner-2005",
          "relationship": "states-problem",
          "locator": "pp. 32-33 (Problem 9)",
          "primary": true
        }
      ],
      "targetClauses": [
        {
          "id": "reduction-implies-majorization",
          "label": "Reduction criterion implies majorization",
          "text": "The archived statement asks whether the reduction criterion for a bipartite state implies the majorization inequalities between the spectrum of the joint state and the spectra of its reductions.",
          "resolutionCriteria": "A proof of the implication, or a state satisfying the reduction criterion whose spectra violate majorization."
        }
      ]
    }
  ],
  "claims": [
    {
      "kind": "Claim",
      "id": "claim-krueger-2005-reduction-criterion-majorization-hiroshima-proves-the-reduction",
      "statementId": "krueger-2005-reduction-criterion-majorization-statement-v1",
      "targetClauseIds": [
        "reduction-implies-majorization"
      ],
      "relation": "resolves",
      "title": "Hiroshima proves the reduction criterion implies majorization",
      "text": "Hiroshima shows that the reduction inequality yields an operator R of norm at most one with rho_AB^(1/2) = (rho_A^(1/2) tensor I) R, from which one constructs a substochastic matrix relating the two spectra. This gives weak submajorization, which upgrades to ordinary majorization because both spectra have unit trace, so the archived implication holds and majorization is the weakest criterion in the hierarchy."
    }
  ],
  "evidence": [
    {
      "kind": "Evidence",
      "id": "evidence-krueger-2005-reduction-criterion-majorization-physical-review-letters",
      "claimId": "claim-krueger-2005-reduction-criterion-majorization-hiroshima-proves-the-reduction",
      "sourceId": "source-hiroshima-2003-majorization",
      "sourceLocator": "Main theorem",
      "date": "2003",
      "maturity": "Peer reviewed",
      "strength": "Exact theorem",
      "label": "Physical Review Letters"
    }
  ],
  "decisions": [
    {
      "kind": "Decision",
      "id": "decision-krueger-2005-reduction-criterion-majorization-status-2026-08-12",
      "problemId": "krueger-2005-reduction-criterion-majorization",
      "statementId": "krueger-2005-reduction-criterion-majorization-statement-v1",
      "decisionType": "status-assessment",
      "outcome": "accepted",
      "supersedesDecisionId": null,
      "status": "solved",
      "effectiveDate": "2026-08-12",
      "verified": "2026-08-12",
      "evidenceIds": [
        "evidence-krueger-2005-reduction-criterion-majorization-physical-review-letters"
      ],
      "rationale": "The cited peer-reviewed theorem proves exactly the implication asked for in the archived statement."
    }
  ],
  "editorial": {
    "cautions": [],
    "interpretation": null,
    "provenance": null,
    "notices": [],
    "notesPath": "notes.md"
  },
  "sourceImport": null
}
