{
  "schemaVersion": "0.2.0",
  "kind": "qop-canonical-record",
  "problem": {
    "kind": "Problem",
    "id": "krueger-2005-sic-povm-zauner-conjecture",
    "accession": null,
    "aliases": [],
    "catalogState": "published",
    "title": "SIC POVMs and Zauner's conjecture",
    "proposed": "2005-02-17",
    "topicId": "quantum-designs",
    "collectionId": "krueger-2005",
    "question": {
      "type": "Existence and symmetry",
      "summary": "Unconditional SIC existence, Weyl-Heisenberg-covariant existence and Zauner-symmetric existence remain unproved in arbitrary dimension.",
      "importance": "SICs give minimal tomography and optimal projective designs. Zauner symmetry links their existence to finite groups and algebraic number theory, offering a route to exact constructions.",
      "unresolved": "Prove or refute the nested all-dimension SIC, covariance and Zauner-symmetry conjectures without unproved arithmetic assumptions."
    },
    "keywords": [
      "SIC-POVM",
      "Zauner conjecture",
      "Weyl-Heisenberg covariance",
      "Stark units"
    ],
    "relatedProblemIds": [
      "horodecki-2020-sic-povm-infinite-dimensions"
    ]
  },
  "statements": [
    {
      "kind": "StatementVersion",
      "id": "krueger-2005-sic-povm-zauner-conjecture-statement-v1",
      "problemId": "krueger-2005-sic-povm-zauner-conjecture",
      "version": 1,
      "supersedesStatementId": null,
      "created": "2026-08-12",
      "bodyPath": "statements/v1.md",
      "sourceRefs": [
        {
          "sourceId": "source-krueger-werner-2005",
          "relationship": "states-problem",
          "locator": "p. 60-63 (Problem 23)",
          "primary": true,
          "statedTitle": "SIC POVMs and Zauner's Conjecture"
        }
      ],
      "targetClauses": [
        {
          "id": "archived-statement",
          "label": "Archived statement",
          "text": "The formal statement of this version, as archived from the source.",
          "resolutionCriteria": "Prove or refute the nested all-dimension SIC, covariance and Zauner-symmetry conjectures without unproved arithmetic assumptions."
        }
      ]
    }
  ],
  "claims": [
    {
      "kind": "Claim",
      "id": "claim-krueger-2005-sic-povm-zauner-conjecture-2026-an-unconditional-proof-claim",
      "statementId": "krueger-2005-sic-povm-zauner-conjecture-statement-v1",
      "targetClauseIds": [
        "archived-statement"
      ],
      "relation": "status-review",
      "title": "An unconditional proof claim was withdrawn as incorrect",
      "text": "The arXiv record for Joka's claimed all-dimension construction explicitly says the proof is not correct."
    },
    {
      "kind": "Claim",
      "id": "claim-krueger-2005-sic-povm-zauner-conjecture-2025-a-uniform-construction-is",
      "statementId": "krueger-2005-sic-povm-zauner-conjecture-statement-v1",
      "targetClauseIds": [
        "archived-statement"
      ],
      "relation": "narrows",
      "title": "A uniform construction is conditional on two conjectures",
      "text": "Appleby, Flammia and Kopp require an order-one abelian Stark conjecture and a special-value identity for a modular cocycle."
    }
  ],
  "evidence": [
    {
      "kind": "Evidence",
      "id": "evidence-krueger-2005-sic-povm-zauner-conjecture-2026-an-unconditional-proof-claim",
      "claimId": "claim-krueger-2005-sic-povm-zauner-conjecture-2026-an-unconditional-proof-claim",
      "sourceId": "source-joka-2026-a-proof-of",
      "sourceLocator": null,
      "date": "2026-05-31",
      "maturity": "Withdrawn",
      "strength": "Incorrect claim",
      "label": "Withdrawal notice"
    },
    {
      "kind": "Evidence",
      "id": "evidence-krueger-2005-sic-povm-zauner-conjecture-2025-a-uniform-construction-is",
      "claimId": "claim-krueger-2005-sic-povm-zauner-conjecture-2025-a-uniform-construction-is",
      "sourceId": "source-appleby-2025-a-constructive-approach",
      "sourceLocator": null,
      "date": "2025-03-17",
      "maturity": "Preprint",
      "strength": "Conditional theorem",
      "label": "Conditional construction"
    }
  ],
  "decisions": [
    {
      "kind": "Decision",
      "id": "decision-krueger-2005-sic-povm-zauner-conjecture-status-2026-08-12",
      "problemId": "krueger-2005-sic-povm-zauner-conjecture",
      "statementId": "krueger-2005-sic-povm-zauner-conjecture-statement-v1",
      "decisionType": "status-assessment",
      "outcome": "accepted",
      "supersedesDecisionId": null,
      "status": "open",
      "effectiveDate": "2026-08-12",
      "verified": "2026-08-12",
      "evidenceIds": [
        "evidence-krueger-2005-sic-povm-zauner-conjecture-2026-an-unconditional-proof-claim",
        "evidence-krueger-2005-sic-povm-zauner-conjecture-2025-a-uniform-construction-is"
      ],
      "rationale": "Status assessed against the archived statement in the 2026-08-12 primary-source audit; the evidence ledger lists the results considered."
    }
  ],
  "editorial": {
    "cautions": [
      {
        "label": "Claim status",
        "text": "A withdrawn proof and a theorem conditional on two open conjectures do not establish Zauner's conjecture.",
        "url": "https://arxiv.org/abs/2601.13475"
      }
    ],
    "interpretation": null,
    "provenance": null,
    "notices": [],
    "notesPath": "notes.md"
  },
  "sourceImport": null
}
